{
  "schemaVersion": "1.0.0",
  "format": "FIT",
  "parser": { "name": "fit", "version": "1.0.0" },
  "recordCount": 9,
  "fileType": "activity",
  "sessions": [
    {
      "index": 0,
      "sport": "running",
      "subSport": "trail",
      "manufacturer": "garmin",
      "startTime": "2026-10-20T21:00:00Z",
      "utcOffsetMinutes": -180,
      "summary": {
        "elapsedSeconds": 3,
        "movingSeconds": 3,
        "distanceMeters": 8.4,
        "avgHeartRate": 122,
        "maxHeartRate": 125,
        "avgCadence": 85,
        "maxCadence": 86,
        "avgSpeedMps": 2.8,
        "trainingEffectAerobic": 1.2
      },
      "labels": {},
      "texts": {},
      "sourcePaths": {
        "distanceMeters": "session[0].total_distance",
        "avgHeartRate": "session[0].avg_heart_rate"
      },
      "samples": {
        "offsetSeconds": [0, 1, 2, 3],
        "distanceMeters": [0, 2.8, 5.6, 8.4],
        "heartRate": [120, 122, null, 125],
        "speedMps": [2.8, 2.8, 2.8, 2.8],
        "cadence": [84, 85, 85, 86]
      }
    }
  ]
}
